{
  "$schema": "https://json-schema.org/draft/2020-12/schema",
  "$id": "https://example.invalid/pi-extensions/subtree-metadata.schema.json",
  "title": "pi extension subtree metadata",
  "type": "object",
  "additionalProperties": false,
  "required": [
    "$schema",
    "name",
    "prefix",
    "source",
    "remote",
    "ref",
    "upstreamCommit",
    "squash",
    "lastSyncedAt"
  ],
  "properties": {
    "$schema": { "type": "string" },
    "name": {
      "type": "string",
      "pattern": "^[a-z0-9][a-z0-9-]*$"
    },
    "prefix": {
      "type": "string",
      "pattern": "^packages/[a-z0-9][a-z0-9-]*$"
    },
    "upstreamPath": {
      "type": "string",
      "minLength": 1,
      "pattern": "^(?!/)(?!.*(?:^|/)\\.\\.?($|/)).+$"
    },
    "source": {
      "type": "string",
      "minLength": 1
    },
    "remote": {
      "type": "string",
      "pattern": "^upstream-[a-z0-9][a-z0-9-]*$"
    },
    "ref": {
      "type": "string",
      "minLength": 1
    },
    "version": {
      "type": ["string", "null"]
    },
    "upstreamCommit": {
      "type": "string",
      "pattern": "^[0-9a-f]{40}$"
    },
    "squash": { "const": true },
    "lastSyncedAt": {
      "type": "string",
      "format": "date-time"
    },
    "notes": { "type": "string" },
    "reapplyOnSync": {
      "type": "array",
      "items": { "type": "string", "minLength": 1 }
    },
    "doNotReintroduce": {
      "type": "array",
      "items": { "type": "string", "minLength": 1 }
    },
    "knownDebt": {
      "type": "array",
      "items": {
        "type": "object",
        "additionalProperties": false,
        "required": ["kind", "reason"],
        "properties": {
          "path": { "type": "string", "minLength": 1 },
          "kind": {
            "type": "string",
            "pattern": "^(noise|deleted|lint|test|other)$"
          },
          "reason": { "type": "string", "minLength": 1 },
          "recordedAt": { "type": "string", "format": "date-time" }
        }
      }
    }
  }
}
