{
  "$schema": "../schemas/subtree-metadata.schema.json",
  "name": "pi-context-cap",
  "prefix": "packages/pi-context-cap",
  "source": "https://github.com/lukeramsden/pi-context-cap.git",
  "remote": "upstream-pi-context-cap",
  "ref": "main",
  "version": "v1.0.1",
  "upstreamCommit": "6771c67040874b6708f0139c735b654675c011c3",
  "squash": true,
  "lastSyncedAt": "2026-09-01T00:00:00+08:00",
  "notes": "Forked from lukeramsden/pi-context-cap (npm @lukeramsden/pi-context-cap v1.0.1). The fork contract lives in openspec (change fork-pi-context-cap).",
  "knownDebt": [],
  "reapplyOnSync": [
    "keep the packaging divergence: npm name @xzzpig/pi-context-cap, the README fork notice and the CHANGELOG 0.1.0 fork entry",
    "keep the fork-only config.ts/whitelist.ts modules additive, with the upstream core logic staying in extensions/context-cap.ts and only wiring into them",
    "keep the config-file support (global context-cap.json plus project .pi/context-cap.json, key-level merge, project-trusted guard) with the models whitelist and budget/reserve, plus the session tri-state override /context-cap on|off|default",
    "keep the CLI flags on the same strict parser as the config file (an out-of-range value such as 200k is rejected with a warning, not truncated), while /context-cap <tokens> keeps upstream's original parsing"
  ],
  "doNotReintroduce": [
    "package files keep upstream's own tab formatting (the package is listed in root .prettierignore)",
    "the .github/workflows are dead in the monorepo and stay byte-identical to upstream"
  ]
}
