{
  "$schema": "../schemas/subtree-metadata.schema.json",
  "name": "pi-goal-x",
  "prefix": "packages/pi-goal-x",
  "source": "https://github.com/tmonk/pi-goal-x.git",
  "remote": "upstream-pi-goal-x",
  "ref": "v0.31.9",
  "version": "0.31.9",
  "upstreamCommit": "a5bdf61bed449735132a61da983c3f6a5ae82222",
  "squash": true,
  "lastSyncedAt": "2026-09-25T17:38:31+08:00",
  "notes": "Forked from the pi-goal-x upstream. Capability contracts live in openspec (spec goal-completion-auditing; the goal-persisted-event-channels spec for the persisted message channels) and in the package-local spec specs/2026-09-12-escape-foreign-ui-prompt-guard for the Escape/ui-prompt guard.",
  "knownDebt": [
    {
      "kind": "lint",
      "path": "packages/pi-goal-x/experiments/context/run-gate.mjs",
      "reason": "pi-lens finding on upstream-original code (JSON.parse without try/catch); left unchanged per the policy of keeping upstream bytes rather than adding inline suppressions.",
      "recordedAt": "2026-09-28T02:09:09+08:00"
    },
    {
      "kind": "lint",
      "path": "packages/pi-goal-x/extensions/goal-prompt-cache.ts",
      "reason": "pi-lens finding (no-unknown-returns) on upstream-original code; left unchanged per the policy of keeping upstream bytes.",
      "recordedAt": "2026-09-28T02:09:09+08:00"
    },
    {
      "kind": "lint",
      "path": "packages/pi-goal-x/tests/e2e/goal-prompt-cache-sdk.test.ts",
      "reason": "pi-lens finding on an upstream-original test file; left unchanged per the policy of keeping upstream bytes.",
      "recordedAt": "2026-09-28T02:09:09+08:00"
    },
    {
      "kind": "lint",
      "path": "packages/pi-goal-x/tests/goal-prompt-cache.test.ts",
      "reason": "pi-lens finding on an upstream-original test file; left unchanged per the policy of keeping upstream bytes.",
      "recordedAt": "2026-09-28T02:09:09+08:00"
    },
    {
      "kind": "lint",
      "path": "packages/pi-goal-x/tests/goal-tool-visibility.test.ts",
      "reason": "Three empty catch blocks around rmSync cleanup on upstream-original lines (upstream 64/162/219). Kept byte-identical per the debt policy: no per-site suppressions inside upstream files.",
      "recordedAt": "2026-09-28T02:09:09+08:00"
    },
    {
      "kind": "lint",
      "path": "packages/pi-goal-x/tests/integration/extension.test.ts",
      "reason": "Empty catch blocks around rmSync/chmodSync cleanup on upstream-original lines (upstream 140/194/918); kept byte-identical rather than annotating upstream code.",
      "recordedAt": "2026-09-28T02:09:09+08:00"
    },
    {
      "kind": "noise",
      "path": "packages/pi-goal-x/extensions/goal-completion.ts",
      "reason": "Diff-alignment artifact: the fork's code move and try-block wrapping indent these upstream-origin lines one level deeper than upstream, so the raw-vs-`-w` numstat delta is whitespace that cannot be restored without breaking the fork structure.",
      "recordedAt": "2026-09-28T05:40:00+08:00"
    },
    {
      "kind": "noise",
      "path": "packages/pi-goal-x/extensions/goal-questionnaire.ts",
      "reason": "Diff-alignment artifact: the fork's code move and try-block wrapping indent these upstream-origin lines one level deeper than upstream, so the raw-vs-`-w` numstat delta is whitespace that cannot be restored without breaking the fork structure.",
      "recordedAt": "2026-09-28T05:40:00+08:00"
    },
    {
      "kind": "noise",
      "path": "packages/pi-goal-x/extensions/widgets/goal-widget.ts",
      "reason": "Diff-alignment artifact: the fork's code move and try-block wrapping indent these upstream-origin lines one level deeper than upstream, so the raw-vs-`-w` numstat delta is whitespace that cannot be restored without breaking the fork structure.",
      "recordedAt": "2026-09-28T05:40:00+08:00"
    },
    {
      "kind": "noise",
      "path": "packages/pi-goal-x/tests/goal-auditor.test.ts",
      "reason": "Diff-alignment artifact: the fork's code move and try-block wrapping indent these upstream-origin lines one level deeper than upstream, so the raw-vs-`-w` numstat delta is whitespace that cannot be restored without breaking the fork structure.",
      "recordedAt": "2026-09-28T05:40:00+08:00"
    },
    {
      "kind": "noise",
      "path": "packages/pi-goal-x/tests/goal-drafting.test.ts",
      "reason": "Diff-alignment artifact: the fork's code move and try-block wrapping indent these upstream-origin lines one level deeper than upstream, so the raw-vs-`-w` numstat delta is whitespace that cannot be restored without breaking the fork structure.",
      "recordedAt": "2026-09-28T05:40:00+08:00"
    },
    {
      "kind": "noise",
      "path": "packages/pi-goal-x/tests/goal-prompts.test.ts",
      "reason": "Diff-alignment artifact: the fork's code move and try-block wrapping indent these upstream-origin lines one level deeper than upstream, so the raw-vs-`-w` numstat delta is whitespace that cannot be restored without breaking the fork structure.",
      "recordedAt": "2026-09-28T05:40:00+08:00"
    },
    {
      "kind": "noise",
      "path": "packages/pi-goal-x/tests/goal-tool-visibility.test.ts",
      "reason": "Diff-alignment artifact: the fork's code move and try-block wrapping indent these upstream-origin lines one level deeper than upstream, so the raw-vs-`-w` numstat delta is whitespace that cannot be restored without breaking the fork structure.",
      "recordedAt": "2026-09-28T05:40:00+08:00"
    },
    {
      "kind": "noise",
      "path": "packages/pi-goal-x/tests/integration/extension.test.ts",
      "reason": "Diff-alignment artifact: the fork's code move and try-block wrapping indent these upstream-origin lines one level deeper than upstream, so the raw-vs-`-w` numstat delta is whitespace that cannot be restored without breaking the fork structure.",
      "recordedAt": "2026-09-28T05:40:00+08:00"
    }
  ],
  "reapplyOnSync": [
    "restore package-lock.json to upstream bytes",
    "keep goal-prompts.ts upstream space-indent inside cachedPrompt/retainedTaskChars, and keep goal-policy.ts byte-identical",
    "re-apply the settings nested auditor group (legacy flat aliases fold into auditor.* leaves, nested wins per file, no deprecated_key diagnostics); map any new upstream flat auditor setting through the nested group",
    "re-apply the auditor prompt design: baseChecklist/auditor.checklist override plus the structured_output protocol, the buildGoalAuditorPrompt injection order, the always-preserved protocol tail, byte-identical output when unset, and feedbackNotes appending to rejectionText in goal-completion.ts",
    "extend goal-drafting's strip regex to strip the 'Budget: …' prefix line",
    "re-apply the agents/goal-auditor.md deletion if upstream re-adds it",
    "keep the fork section on top of the upstream history in CHANGELOG.md and README.md and re-apply the fork wording (every sync conflicts on both)"
  ],
  "doNotReintroduce": [
    "do not restore the temp-dir PI_SUBAGENT_EXTRA_AGENT_DIRS materialization",
    "do not adopt upstream's auditor checklist rewording, its <approved/> verdict protocol, or its runGoalQuestionnaire flow (the fork keeps baseChecklist/auditor.checklist, structured_output and the fork questionnaire UI)",
    "do not revert the tsconfig target from ES2023 (ES2022 breaks typecheck)"
  ]
}
