{
  "$schema": "../schemas/subtree-metadata.schema.json",
  "name": "pi-permission-system",
  "prefix": "packages/pi-permission-system",
  "upstreamPath": "packages/pi-permission-system",
  "source": "https://github.com/gotgenes/pi-packages.git",
  "remote": "upstream-pi-permission-system",
  "ref": "pi-permission-system-v40.1.2",
  "version": "pi-permission-system-v40.1.2",
  "upstreamCommit": "dcb4cc3d96438652e824ff19fae15085cfeec2b0",
  "squash": true,
  "lastSyncedAt": "2026-10-10T06:46:19Z",
  "notes": "Forked from gotgenes/pi-packages; wrapper-floor rework (fallback mode) intentionally diverges from upstream — behavior contract lives in the bash-wrapper-floors spec.",
  "knownDebt": [
    {
      "kind": "noise",
      "path": "packages/pi-permission-system/schemas/permissions.schema.json",
      "reason": "Generated artifact: `pnpm run gen:schema` (scripts/generate-permissions-schema.ts) rewrites this file and then runs `biome format --write`, whose default indentation is tabs, while upstream ships 2-space. The tab indentation is produced by the generator, not by hand-reformatting; re-running gen:schema re-applies it.",
      "recordedAt": "2026-09-28T02:09:09+08:00"
    },
    {
      "kind": "noise",
      "path": "packages/pi-permission-system/src/authority/forwarded-request-server.ts",
      "reason": "Diff-alignment artifact: the fork's guard or try wrapping indents these upstream-origin lines one level deeper than upstream, so the raw-vs-`-w` numstat delta is whitespace that cannot be restored without breaking the fork structure.",
      "recordedAt": "2026-09-28T05:40:00+08:00"
    },
    {
      "kind": "noise",
      "path": "packages/pi-permission-system/test/authority/approval-escalator.test.ts",
      "reason": "Diff-alignment artifact: the fork's guard or try wrapping indents these upstream-origin lines one level deeper than upstream, so the raw-vs-`-w` numstat delta is whitespace that cannot be restored without breaking the fork structure.",
      "recordedAt": "2026-09-28T05:40:00+08:00"
    },
    {
      "kind": "noise",
      "path": "packages/pi-permission-system/test/composition-root.test.ts",
      "reason": "Diff-alignment artifact: the fork's guard or try wrapping indents these upstream-origin lines one level deeper than upstream, so the raw-vs-`-w` numstat delta is whitespace that cannot be restored without breaking the fork structure.",
      "recordedAt": "2026-09-28T05:40:00+08:00"
    },
    {
      "kind": "noise",
      "path": "packages/pi-permission-system/test/access-intent/bash/program.test.ts",
      "reason": "Diff-alignment artifact: the fork's inner-unit expectations on upstream v37's heredoc/redirect test cases and the #875 salvaged case indent the expectation entries against upstream's rewritten blocks, so the raw-vs-`-w` numstat delta is whitespace that cannot be restored without losing the fork expectations.",
      "recordedAt": "2026-10-03T02:00:00+08:00"
    }
  ],
  "reapplyOnSync": [
    "dual-layer resolveProfileScopes + manager spread",
    "RuleOrigin union members",
    "probe import + refreshConfig warning",
    "loadProjectConfig profiles spread",
    "makeCommandUnit keeps fork classifyWrapperCommand emission (wrapper + inner units), upstream home/argument spellings and floorExemptionOf against redirectedScope(node, scope); classification receives the upstream WordReader to recognize literal quoted sudo names and ArgumentSpeller to retain source-aligned inner/executed spellings; BashCommand/UnitFacts carry executedSpellings; collectTimedSubshell emits its already-descended subshell once without an extra fork wrapper inner unit",
    "wrapper-floors readWrapperCommand skips REDIRECT_NODE_TYPES children",
    "collectCommands retains upstream (node, words, speller) arguments and accepts a fourth options.parseProgram argument for the fork payload parser; BashProgram.build and wrapper-parse carry it through both asynchronous and synchronous parsing",
    "wrapper-floors innerCommandText slices the inner unit from word-joined, heredoc-body-free unit text by mapping the inner token offset through wrapper args rather than node.text.slice(start)",
    "program.test.ts and program-parse-sync.test.ts expectations retain fork wrapper_payload/wrapper_indirection units beside upstream command spellings, heredoc/redirect and salvaged cases",
    "bash-command-metamorphic.test.ts retains conservative inner-unit denies for computed timeout payloads that upstream only floors to ask; composition-root.test.ts explicitly selects always for the wrapper-floor forwarding case because fork config defaults to fallback",
    "permission-manager.ts keeps dual-layer profile scopes, invalidProfileName and warnings beside upstream legacyMcpToolKeys relocation; getPolicyIssues returns profile diagnostics through the upstream PolicyIssueReporter",
    "schemas/permissions.schema.json is regenerated with pnpm run gen:schema over fork schema sources; generator tab indentation is declared knownDebt",
    "test/path/native-tool-target.test.ts and test/path/path-flavor.test.ts deep-import hoisted dependencies through ../../../../node_modules/... rather than the upstream package-local ../../node_modules/... path",
    "resolveWrapperUnit keeps the fork fallback option and uses upstream floorToAsk so unresolved fallback asks carry floor/askingUnits through forwarding; exempt inner resolution consumes cmd.executedSpellings instead of discarding its aliases; advisory checks pass wrapperFloors after the new PathNormalizer argument",
    "wrapper-analysis.ts exports innerCommandIndex with an optional allowEmpty=false parameter carried into getoptInnerIndex; fork classifySudo reuses that grammar with allowEmpty=true so rejected syntax floors while legal payload-less invocations remain inert; quote removal is per literal CommandWord.value while source offsets/text remain unchanged, and recognized indirection chains carry refused sudo floors and correctly located sudo inner units",
    "bash-command.test.ts expects explicit inner rm denies to outrank the outer floor for correctly parsed sudo --user/-nu cases; program.test.ts keeps refused sudo compound syntax unresolved"
  ],
  "doNotReintroduce": [
    "do not re-inline the wrapper-classification block into command-enumeration.ts on sync",
    "do not let biome/prettier reformat upstream files in this package: upstream-owned regions are 2-space, fork-authored regions stay tab-indented",
    "do not adopt upstream release-number CHANGELOG sections; keep the independent fork release sections",
    "do not restore the old sync-commands parser: upstream BashProgram.parseSync and its shared builder retain the fork payload parser",
    "do not restore blanket always-mode flooring for proven execution modifiers; both modes retain upstream core-reader and execution-modifier exemptions",
    "do not restore the fork sudo value-options table or allow refused/unknown sudo modes through fallback; classifySudo reuses upstream grammar and floors unresolved forms",
    "do not drop source-aligned inner/exempt command spellings at wrapper seams or fabricate aliases for computed paths and opaque payloads from outer scope"
  ]
}
