{
  "$schema": "../schemas/subtree-metadata.schema.json",
  "name": "sandbox-runtime",
  "prefix": "packages/sandbox-runtime",
  "source": "https://github.com/carderne/sandbox-runtime.git",
  "remote": "upstream-sandbox-runtime",
  "ref": "v0.0.72",
  "version": "0.0.72",
  "upstreamCommit": "dea3f1a241c189f0f954ac989dfc2c2a95b64c39",
  "squash": true,
  "lastSyncedAt": "2026-09-17T01:05:00+08:00",
  "notes": "Forked from carderne/sandbox-runtime (itself derived from Anthropic's sandbox-runtime). The fork adds filesystem.protectNonexistentFiles so embedders can skip bwrap placeholder mounts for not-yet-existing dangerous files, and network.disabled so a session can run with all network policy enforcement off. Published locally as @xzzpig/sandbox-runtime: it is a support library for pi-sandbox rather than a Pi plugin, so this record keeps the plain upstream-derived name instead of the pi-* plugin convention.",
  "knownDebt": [
    {
      "kind": "other",
      "path": "packages/sandbox-runtime/package.json",
      "reason": "The exact typescript 5.6.3 pin is deliberate (upstream's build depends on it); do not widen without a build check.",
      "recordedAt": "2026-09-28T02:09:09+08:00"
    },
    {
      "kind": "noise",
      "path": "packages/sandbox-runtime/README.md",
      "reason": "Upstream's README carries a stray `<<<<<<< HEAD` line at column 0; the fork indents it two spaces because it sits inside a markdown list, and restoring column 0 fails the root `prettier --check`.",
      "recordedAt": "2026-09-28T05:40:00+08:00"
    }
  ],
  "reapplyOnSync": [
    "network.disabled, filesystem.protectNonexistentFiles, the readdirSync withFileTypes cast in sandbox-utils.ts, and the closeAllConnections cast in sandbox-manager.ts",
    "keep src/sandbox/fork-network.ts (isNetworkDisabled) as the consolidated network.disabled precedence with its two sandbox-manager.ts call sites",
    "keep pathEntryLstatExists exported (plus the root re-export) for the pi-sandbox fork, whose duplicate pathEntryExists was removed",
    "keep the protectNonexistentFiles tests in fork-only test/sandbox/protect-nonexistent-files.test.ts"
  ],
  "doNotReintroduce": [
    "package-lock.json keeps upstream bytes with only the two name fields set to @xzzpig/sandbox-runtime (unconsumed by the pnpm monorepo)",
    "the exact typescript 5.6.3 pin is deliberate — do not widen it without a build check"
  ]
}
