{
  "$schema": "../schemas/subtree-metadata.schema.json",
  "name": "pi-sandbox",
  "prefix": "packages/pi-sandbox",
  "source": "https://github.com/carderne/pi-sandbox.git",
  "remote": "upstream-pi-sandbox",
  "ref": "v0.7.1",
  "version": "0.7.1",
  "upstreamCommit": "ad8c63c18eec7c70e3a91653758bd19eb1ae484c",
  "squash": true,
  "lastSyncedAt": "2026-10-10T06:30:00Z",
  "notes": "Forked from carderne/pi-sandbox. The fork adds optional pi-tool-display bash rendering decoration (falling back to built-in rendering when pi-tool-display is absent), named sandbox profiles for subagents, the per-session SandboxService profile layer, a runtime in-memory profile registry (registerSandboxProfiles; user sandbox.json definitions of the same name keep priority), network.disabled, and protectNonexistentFiles passthrough. The project-scoped profile contract lives in openspec (change add-project-scoped-profiles, spec project-sandbox-profiles); the runtime registration contract lives in openspec change add-pi-openspec-x (design D4).",
  "knownDebt": [
    {
      "kind": "deleted",
      "path": "packages/pi-sandbox/pnpm-lock.yaml",
      "reason": "Upstream lockfile deleted on every pull (git rm packages/pi-sandbox/pnpm-lock.yaml packages/pi-sandbox/pnpm-workspace.yaml); unconsumed by this pnpm monorepo.",
      "recordedAt": "2026-09-28T02:09:09+08:00"
    },
    {
      "kind": "deleted",
      "path": "packages/pi-sandbox/pnpm-workspace.yaml",
      "reason": "Upstream workspace file deleted on every pull; the package is a member of the root pnpm workspace instead.",
      "recordedAt": "2026-09-28T02:09:09+08:00"
    },
    {
      "kind": "noise",
      "path": "packages/pi-sandbox/src/extension.ts",
      "reason": "The fork wraps these upstream-origin calls in its own try/catch seam, so the deeper indentation is required by the fork structure; restoring upstream bytes fails `oxfmt --check`, the package's own formatter gate.",
      "recordedAt": "2026-09-28T05:40:00+08:00"
    },
    {
      "kind": "noise",
      "path": "packages/pi-sandbox/src/ui.ts",
      "reason": "The fork wraps these upstream-origin calls in its own try/catch seam, so the deeper indentation is required by the fork structure; restoring upstream bytes fails `oxfmt --check`, the package's own formatter gate.",
      "recordedAt": "2026-09-28T05:40:00+08:00"
    }
  ],
  "reapplyOnSync": [
    "the session-isolation test's ExtensionToolContext mock cast and sessionManager getSessionId/getSessionFile methods required by Pi 1.0.0's bash spawn context",
    "the sandboxManagerFactory seam, the tool-display decoration, the profile layer, the inherit-not-force rule for network.disabled/filesystem.disabled (an unprovided switch follows the baseline; validateProfileConfig still rejects a profile that sets disabled: true) and protectNonexistentFiles, and the filesystem.allowRead union rule (a profile's allowRead extends the inherited list in both merge paths \u2014 single profile and same-name project profile \u2014 because replacing it made every path outside the project unreadable)",
    "the root index.ts export block's re-export of registerSandboxProfiles/type SandboxProfileDefinition from the fork-only src/fork-profile-registry.ts (upstream index.ts only exports the default)",
    "the profile-config module split",
    "resolveProfile/mergeProfileObjects/validProfileNames",
    "the loadConfig onWarning option and its warning emission",
    "the extension.ts reportProfileWarning plus listProfiles wiring",
    "the refreshSandbox seam delegating to the fork-only src/fork-profile-network.ts applySandboxConfigChange, which re-initializes the manager when a profile newly turns network restriction on (a profile may declare network.disabled: false or inherit a baseline where it is false, while the upstream updateSandboxConfig path cannot start the proxy); its failure path goes through recordProfileStartupFailure, which sets sandboxEnabled/sandboxInitialized to false even when no profile is selected (applySandboxConfigChange may already have reset the manager, so the disabled status is the honest one \u2014 keep that no-profile branch when re-applying)",
    "the fork mergeConfigLayers thin wrapper delegating to the now-exported upstream mergeConfigLayers",
    "the loadConfig delegation that keeps the no-profile path byte-identical to upstream (silent peek reads decide delegation, the profile path re-reads with warnings)",
    "the denyWrite existence check reusing pathEntryLstatExists exported by the sandbox-runtime fork (root re-export added there)",
    "the fork-only packages/pi-sandbox/.prettierignore list, because oxfmt reads .prettierignore as its default ignore list and would otherwise reformat the upstream lines again whenever a seam changes nesting",
    "after each subtree pull run git rm packages/pi-sandbox/pnpm-lock.yaml packages/pi-sandbox/pnpm-workspace.yaml (recurring modify/delete conflict; the package-local workspace files break pnpm pack in the monorepo)",
    "the prepack/postpack scripts in package.json running the fork-only scripts/pack-bundle.mjs: it copies sandbox-runtime's hoisted runtime deps (commander, node-forge, @pondwader/socks5-server \u2014 hoisted to the root node_modules by the workspace's nodeLinker: hoisted) into packages/sandbox-runtime/node_modules before pack and removes them after, because pnpm pack otherwise emits those bundled files at package/../../node_modules paths the npm registry rejects with E415 invalid path; re-add the two script lines whenever a pull overwrites package.json",
    "forward native network.disabled together with allowedDomains to the fork runtime; preserve the domain-prompt and NODE_USE_ENV_PROXY guards, and suppress SSH proxy injection for both bash and user_bash when network.disabled is true, including hot-switches with a retained SOCKS listener",
    "thread session cwd through profile refresh/reinitialization and the live SandboxService, and apply resolved project trust to both profile and no-profile config loading and shell settings; profile-config.ts mirrors the upstream JSONC reader via stripJsonComments",
    "the upstream network.disabled runtime test asserts the fork's native disabled flag and retained allowlist rather than upstream's omitted-allowedDomains implementation",
    "keep the extension warning call through fork-ui-warnings.ts so the upstream Linux unenforced-glob notice retains the fork headless/cosmetic-failure guarantee",
    "keep the sandbox-runtime.ts pattern seam delegating to fork-filesystem-paths.ts so all glob syntax is anchored to baseCwd without being canonicalized as a literal; preserve the runtime call forwarding the execution cwd and abort signal",
    "the upstream sandbox-runtime test expects denyWrite globs anchored to the process/session cwd rather than raw relative text"
  ],
  "doNotReintroduce": [
    "do not introduce gratuitous upstream-file formatting drift; keep fork behavior tests in fork-only files, with only necessary upstream assertion adaptations for the native network.disabled contract and @xzzpig package identity",
    "do not force network or filesystem isolation on inside a profile: a switch the profile does not declare inherits the baseline, so a global network.disabled/filesystem.disabled opt-out stays in force (forcing network isolation broke the common opt-out case by requiring a proxy the runtime never started)",
    "do not go back to replacing the baseline filesystem.allowRead with the profile's own list: a profile's allowRead unions onto the inherited list in both merge paths, because replacing it (the opsx profiles declared only '.') made every path outside the project unreadable \u2014 agent cache and generated skills, subagent result archives, /nix/store, /tmp \u2014 so the opsx planner could not even read its own generated skills; narrowing reads is what denyRead is for, and denyRead still unions",
    "do not adopt upstream's network.disabled implementation that omits allowedDomains; the fork runtime uses the native disabled flag and must keep the allowlist for later restricted profiles",
    "do not widen the existing profile field whitelist during an upstream sync: allowSSHAgentSocket and denyMandatoryCwdFiles are inherited from the global/trusted-project baseline but are not directly configurable by named profiles"
  ]
}
